id,text,term,label_id,label,tvt,pred_0,pred_1,pred_2
1441,"My entree of hot pot with seafood was full of imitation crabmeat with a couple pieces of shrimp and squid, and was unnecessarily heated with a burner.",shrimp,0,negative,val,0.9885749220848083,0.007091662846505642,0.0043333047069609165
1972,I could have drank 4 glasses of water and still been parched - so watch out.,glasses of water,1,neutral,val,0.09996963292360306,0.8774972558021545,0.022533124312758446
2187,The drinks are always welll made and wine selection is fairly priced.,drinks,2,positive,val,0.0008977812831290066,0.0019316988764330745,0.9971705079078674
466,"The bruscetta is a bit soggy, but the salads were fresh, included a nice mix of greens (not iceberg) all dishes are served piping hot from the kitchen.",dishes,2,positive,val,0.016842391341924667,0.7401781678199768,0.24297937750816345
2940,they bring service up a notch by offerng complementary amuse bouche to all tables and gave us a small dessert for our celebration.,dessert,2,positive,val,0.040890369564294815,0.08580668270587921,0.8733029961585999
712,"The service is always bad though, don't expect much of anything from your server, and I would not recommend bringing a date here either.",service,0,negative,val,0.9891695380210876,0.006780607160180807,0.00404976774007082
1714,"I only tried a simple dish of spinach ravioli in a light oil and garlic sauce, but it actually faired better than most NYC Italian joints I've tried similar dishes at.",spinach ravioli in a light oil and garlic sauce,2,positive,val,0.004077606834471226,0.9519296884536743,0.04399264231324196
345,The service is awful.,service,0,negative,val,0.9836766123771667,0.010647841729223728,0.005675497464835644
3114,"To begin, we were told there was a 30 minute wait and started to leave, when the hostess offered to call us on our cell phone when the table was ready.",table,2,positive,val,0.012469964101910591,0.7718477249145508,0.21568231284618378
2114,"we were tired and cold when we got to the restaurant, then we sat down to begin ordering appetizers.",appetizers,1,neutral,val,0.005788780748844147,0.9598094820976257,0.034401725977659225
3001,The staff is courteous and friendly.,staff,2,positive,val,0.0009916606359183788,0.0018034887034446,0.9972048401832581
648,I just wonder how you can have such a delicious meal for such little money.,meal,2,positive,val,0.001049912883900106,0.0015818249667063355,0.9973682761192322
945,"The cafe itself was really nice with comfortable outdoor chairs and tables, but the service could have been better.",service,0,negative,val,0.1349821239709854,0.017137132585048676,0.8478807210922241
1843,The establishment scores big points in presentation and style.,establishment,2,positive,val,0.001254302216693759,0.0036655806470662355,0.9950801134109497
3122,The hostess and the waitress were incredibly rude and did everything they could to rush us out.,waitress,0,negative,val,0.9884286522865295,0.007704988121986389,0.0038663260638713837
1474,"Yes, they use fancy ingredients, but even fancy ingredients don't make for good pizza unless someone knows how to get the crust right.",pizza,0,negative,val,0.008058535866439342,0.5128155946731567,0.47912588715553284
276,We were well attended to by the enthusiastic staff especially the manager Tony Gaskin who made excellent suggestions for our menu selections.,manager,2,positive,val,0.0006359832477755845,0.0032428232952952385,0.9961212277412415
2320,"Service was slow, but the people were friendly.",Service,0,negative,val,0.9840789437294006,0.010103086940944195,0.005817932542413473
866,The staff there is very attentive and down to earth.,staff,2,positive,val,0.0010396686848253012,0.001664218958467245,0.997296154499054
2294,The cold appetizer dishes taste like the way I remember them to taste when I was growing up in Taiwan.,cold appetizer dishes,2,positive,val,0.9649791121482849,0.022322066128253937,0.01269874069839716
1481,"The ingredients taste fresher, the crust is thinner and crispier, the slice is less oily, and it's never burnt like it occasionally is at Joe's.",ingredients,2,positive,val,0.0012515471316874027,0.0015943794278427958,0.9971541166305542
1518,"this is the best secret place in midtown', I heard that from the bartender, after having brilliant food ( try steak with portobello mushrooms) and drinks on the bar last Tuesday.",drinks,2,positive,val,0.004036006052047014,0.9276760220527649,0.06828799098730087
1566,"Just straight up cheap, good food.",food,2,positive,val,0.001461454201489687,0.0017853575991466641,0.9967531561851501
3670,"First the wrong bread came out with the appetizer, then when i tried to order a second glass of wine for my main course...",main course,1,neutral,val,0.003957761917263269,0.9581407904624939,0.037901364266872406
1200,"If the omakase is to showcase technique and variety, serving almost 40% of items BBQ-ed and a spicy tuna roll wrapped with not-so-fresh nori seems to be a rather limp performance.",serving,1,neutral,val,0.988853931427002,0.007601121440529823,0.003544955514371395
2019,"I had the cod with paella (spicy and very filling, I'm a big eater and could only eat half) while my boyfriend had the classic fish and chips (again, a big serving - at least 5 pieces of fish and a basketful of fries).",fish and chips,0,negative,val,0.013886676169931889,0.8732271790504456,0.11288612335920334
2599,The place is so cool and the service is prompt and curtious.,place,2,positive,val,0.001019541174173355,0.0015839687548577785,0.9973964691162109
3470,"And forget what you read under me, the atmosphere isn't that bad either.",atmosphere,1,neutral,val,0.8995763659477234,0.032470040023326874,0.06795360893011093
2491,"Aside from the rushed service, we were very impressed with the food and the drinks.",drinks,2,positive,val,0.005474429577589035,0.014672117307782173,0.9798535108566284
928,I care more about the food and ambience.,ambience,1,neutral,val,0.004531156737357378,0.9261878132820129,0.06928105652332306
1312,The two star chefs left quite some time ago to open their own place.,chefs,1,neutral,val,0.03846229612827301,0.1820736676454544,0.7794640064239502
739,"The food came out wrong, the waiter was no where to be found and the wine showed up at the end of the meal.",meal,1,neutral,val,0.19638873636722565,0.7396628260612488,0.06394844502210617
1664,Service was slow had to wait to order and get food although not crowded.,Service,0,negative,val,0.9662665128707886,0.027679668739438057,0.006053786259144545
2734,"The Italian food has flavor (that can be sort of surprising on the UES), and the service turns from a nightmare to attentive,they sort of remind me of the NY Yankees of the late 90's, no matter how bad it look, you knew that there was a rally just around the corner...",Italian food,2,positive,val,0.04311162605881691,0.023280415683984756,0.9336079955101013
3688,"It is far more popular as a bar than as a restaurant, with only a few tables and the waiter being the bartender, but we greatly enjoyed the unobtrusive atmosphere.",bar,2,positive,val,0.008442310616374016,0.9388870000839233,0.05267062783241272
8,"The service was terrible, we had to wait for everything and ask several of different people for the same thing before we were allowed to be served.",served,0,negative,val,0.9890762567520142,0.007202431093901396,0.0037212076131254435
1302,And their prices are very high - they actually think that they can get away with charging such prices for such terrible food and service!,prices,0,negative,val,0.9885920882225037,0.007203513756394386,0.004204381722956896
3230,"The seafood is amazing, there's a good wine list, and the ever-changing menu always offers some great surprises.",menu,2,positive,val,0.0010226162848994136,0.0015348587185144424,0.9974424839019775
1170,I go back in line like three times on average until I can't walk anymore.,line,0,negative,val,0.004313151817768812,0.9489871263504028,0.04669967666268349
584,Rao's has the best service and atmosphere in NYC.,atmosphere,2,positive,val,0.0011210334487259388,0.0015523236943408847,0.9973266124725342
1845,"However, service was as plain as sesame crusted Salmon I had.",service,1,neutral,val,0.9774355292320251,0.0161984134465456,0.006366013549268246
579,We both opted for a pasta dish and they were served timely and fresh.,served,2,positive,val,0.0006643670494668186,0.00281634833663702,0.9965193271636963
1907,The waitress suggested glasses of wine that went very well with the food.,waitress,2,positive,val,0.03247099369764328,0.8276234865188599,0.1399054378271103
2848,"The menu is Prix Fixe, so be prepared to spend at least $60 per person, but it is Well worth itsuperb food.",menu,0,negative,val,0.026423877105116844,0.9040719866752625,0.06950414180755615
540,The bruschetta and panini's are so yummy!,panini,2,positive,val,0.0011149307247251272,0.0015378708485513926,0.9973471164703369
1226,you can actually get 2 salads worth if u take it home and add it to some lettuce!,salads,0,negative,val,0.003778416197746992,0.9359164834022522,0.060305155813694
1358,Really tasty spring rolls and noodles for a good price though.,price,2,positive,val,0.0011176714906468987,0.0017392697045579553,0.9971430897712708
1459,"The eggplant parmesan is also great, and my friend who grew up in Manhattan claims that no one serves a better baked ziti with meatsauce.",serves,2,positive,val,0.001361898728646338,0.002578530926257372,0.9960596561431885
2204,"It's super-trendy and there's always someone to take that empty seat, so it seems that customer service has been deemed not of the essence.",seat,1,neutral,val,0.11448419839143753,0.7701098322868347,0.11540596187114716
1711,Diner food at bistro prices is a bummer....,food,0,negative,val,0.9869033098220825,0.008241097442805767,0.004855547100305557
2570,On a hot day it was fabulous to stop in and enjoy lunch.,lunch,2,positive,val,0.0010882503120228648,0.001878670766018331,0.9970331192016602
2718,"The first time I went, and was completely taken by the live jazz band and atmosphere, I ordered the Lobster Cobb Salad.",live jazz band,2,positive,val,0.0012349234893918037,0.010218805633485317,0.9885462522506714
3026,"The blond wood decor is very soothing, the premium sake is excellent and the service is great.",service,2,positive,val,0.0011821417137980461,0.0015231493161991239,0.9972947239875793
3048,"They never brought us complimentary noodles, ignored repeated requests for sugar, and threw our dishes on the table.",dishes,0,negative,val,0.8568812012672424,0.12837029993534088,0.014748532325029373
1583,I LOVED THE SHOWS.,SHOWS,2,positive,val,0.0013045810628682375,0.0019145291298627853,0.9967808723449707
3020,"My goodness, everything from the fish to the rice to the seaweed was absolutely amazing.",seaweed,2,positive,val,0.0010419298196211457,0.0016119420761242509,0.997346043586731
2222,Went there and had a combination of different seafood dishes and appetizers.,appetizers,1,neutral,val,0.003464431967586279,0.9519455432891846,0.04458999261260033
1872,"Thalia is a beautiful restaurant with beautiful people serving you, but the food doesn't quite match up.",people serving,2,positive,val,0.0014551684726029634,0.0022328821942210197,0.9963119626045227
967,"No food snobs allowed, this place is for people who appreciate good food.",food,1,neutral,val,0.0010891216807067394,0.002667835680767894,0.9962431192398071
750,The food was well prepared and the service impecable.,service,2,positive,val,0.0008008944569155574,0.0019728748593479395,0.9972261786460876
713,"Besides, when you have bad service, that's less money you have to tip.",money,0,negative,val,0.9823507070541382,0.01138551626354456,0.0062637547962367535
1424,"my picks are:  - Scallion Pancake (fried with vegetable juice, very special and tasty)  - Guizhou Chicken  - Shredded Squid Family Style (one of my personal favorites)  - Sichuan Spicy Soft Shell Crab  - Shuizhu Fish (this one is for hardcore Sichuan food fans, I wouldn't recommend to my American friends as it's very spicy.",Sichuan Spicy Soft Shell Crab,2,positive,val,0.015485618263483047,0.9155215620994568,0.06899288296699524
2084,"The dim sum is ok but doesn't taste that fresh, and the little dishes don't look steamy hot as they should (also note lack of Chinese here).",dim sum,0,negative,val,0.030173856765031815,0.9285156726837158,0.04131044074892998
2646,"Only wine and beer are served, but the house varities are actually quite good.",wine,1,neutral,val,0.03539115935564041,0.8927093148231506,0.07189951092004776
2444,The secret is the lunch menu which offers a complimentary appetizer with every entree ordered.,lunch menu,2,positive,val,0.0008067555609159172,0.0019368864595890045,0.997256338596344
1015,A cool place to hang with your friends for a couple of healthy drinks and desserts.,place,2,positive,val,0.0010096186306327581,0.001638214336708188,0.997352123260498
885,"While this is a pretty place in that overly cute French way, the food was insultingly horrible.",place,2,positive,val,0.9659348130226135,0.009707978926599026,0.024357261136174202
1530,I've overheard comments from him to his employees that should not have been delivered in the dining area and I've been sitting there while he lectured another customer.,dining area,1,neutral,val,0.9743824005126953,0.02241649106144905,0.0032011058647185564
3519,The prices and ambience are especially great considering it's in the West Village.,prices,2,positive,val,0.0010416971053928137,0.0017255606362596154,0.9972327351570129
1949,"If it's just a quick martini at the bar (which I recommend Jeffery's) or a mind blowing Roast Chicken, go to Village!",bar,1,neutral,val,0.00579790398478508,0.9075136780738831,0.08668841421604156
1192,"They sell special sushi, everything have a topping, sauce and etc.",sushi,2,positive,val,0.0007187440060079098,0.005481482949107885,0.9937997460365295
1335,"While we enjoyed the food, we were highly disappointed by the poor service (waiter was not quite competent and SLOW service) and lack of remorse.",service,0,negative,val,0.9884788393974304,0.006861405912786722,0.004659685771912336
1296,They charge different prices all the time.,prices,0,negative,val,0.5337137579917908,0.4484744369983673,0.017811771482229233
1089,"The sandwiches are dry, tasteless and way overpriced.",sandwiches,0,negative,val,0.9879404306411743,0.0074731879867613316,0.004586325027048588
984,i've been back to nha trang literally a hundred times for the beef cubes - they're that good.,beef cubes,2,positive,val,0.001964008202776313,0.11773999035358429,0.880295991897583
924,With the theater 2 blocks away we had a delicious meal in a beautiful room.,room,2,positive,val,0.0009413055377081037,0.0017517482629045844,0.9973069429397583
1867,"The first 2 courses were very good, but the chocolate sampler was too rich for me and the dessert wine far too sweet.",chocolate sampler,0,negative,val,0.001385122537612915,0.0015367628075182438,0.9970781803131104
109,"I haven't eat a lamb chop as delicious as that,the salads are really nice dressed with lemon and extra virgnin olive oil.",extra virgnin olive oil,2,positive,val,0.0009725947747938335,0.002231840044260025,0.9967955946922302
3139,"Where tanks in other Chinatown restaurants display a lurking myriad of sad-looking marine life in their murky waters, the tanks at Ping's are clear as glass with healthy-looking creatures who do not yet know that they will be part of some dim sum lover's brunch.",dim sum,1,neutral,val,0.011218064464628696,0.9319813251495361,0.05680065229535103
2938,"they didn't disappoint, service from the second i arrived at the door was extremely pleasant and attentive with almost one server per table.",server,2,positive,val,0.0007638070965185761,0.0019411758985370398,0.9972949624061584
2284,The food is okay and the prices here are mediocre.,food,1,neutral,val,0.005193511489778757,0.9345691800117493,0.0602373443543911
32897564#894393#2,The bread is top notch as well.,bread,2,positive,test,0.000985220423899591,0.0017876551719382405,0.997227132320404
33070600#670328#0,I have to say they have one of the fastest delivery times in the city.,delivery times,2,positive,test,0.0012101951288059354,0.0022051192354410887,0.9965846538543701
33070600#670328#2,Food is always fresh and hot- ready to eat!,Food,2,positive,test,0.0010407186346128583,0.001651386613957584,0.9973078966140747
36244464#949326#5,Did I mention that the coffee is OUTSTANDING?,coffee,2,positive,test,0.0009167506941594183,0.009785301983356476,0.9892979860305786
32894246#870052#0,"Certainly not the best sushi in New York, however, it is always fresh, and the place is very clean, sterile.",place,2,positive,test,0.03571195527911186,0.010909372009336948,0.9533786177635193
32894246#870052#1,"I trust the people at Go Sushi, it never disappoints.",people,2,positive,test,0.0006170223350636661,0.003571235341951251,0.9958118200302124
32894246#870052#2,"Straight-forward, no surprises, very decent Japanese food.",Japanese food,2,positive,test,0.0009206360555253923,0.002062450395897031,0.9970169067382812
35390182#756337#4,"BEST spicy tuna roll, great asian salad.",asian salad,2,positive,test,0.0011889487504959106,0.0017895821947604418,0.997021496295929
35390182#756337#4,"BEST spicy tuna roll, great asian salad.",spicy tuna roll,2,positive,test,0.0012425470631569624,0.0017970468616113067,0.9969603419303894
35390182#756337#5,Try the rose roll (not on menu).,rose roll,2,positive,test,0.001703520305454731,0.026845348998904228,0.9714511632919312
35390182#756337#5,Try the rose roll (not on menu).,menu,1,neutral,test,0.017578212544322014,0.5986616611480713,0.38376009464263916
11447227#436718#3,"I love the drinks, esp lychee martini, and the food is also VERY good.",drinks,2,positive,test,0.0007895911694504321,0.0019199595553800464,0.9972904920578003
11447227#436718#3,"I love the drinks, esp lychee martini, and the food is also VERY good.",lychee martini,2,positive,test,0.0007324269972741604,0.0022393623366951942,0.9970282912254333
11447227#436718#3,"I love the drinks, esp lychee martini, and the food is also VERY good.",food,2,positive,test,0.0009520917665213346,0.0016595055349171162,0.9973884224891663
33071731#1007204#3,"In fact, this was not a Nicoise salad and was barely eatable.",Nicoise salad,0,negative,test,0.9434856176376343,0.04688838869333267,0.009626067243516445
33085939#758010#0,"While there's a decent menu, it shouldn't take ten minutes to get your drinks and 45 for a dessert pizza.",menu,2,positive,test,0.001526778331026435,0.00820898450911045,0.9902642965316772
33085939#758010#0,"While there's a decent menu, it shouldn't take ten minutes to get your drinks and 45 for a dessert pizza.",drinks,1,neutral,test,0.005408366676419973,0.8790760636329651,0.1155155599117279
33085939#758010#0,"While there's a decent menu, it shouldn't take ten minutes to get your drinks and 45 for a dessert pizza.",dessert pizza,1,neutral,test,0.005480492953211069,0.9170321226119995,0.07748747617006302
11313431#524365#3,"Once we sailed, the top-notch food and live entertainment sold us on a unforgettable evening.",food,2,positive,test,0.0010010217083618045,0.001709097996354103,0.9972898960113525
11313431#524365#3,"Once we sailed, the top-notch food and live entertainment sold us on a unforgettable evening.",live entertainment,2,positive,test,0.0013343372847884893,0.001698196865618229,0.9969674944877625
11359717#1138929#1,Our waiter was horrible; so rude and disinterested.,waiter,0,negative,test,0.9878872632980347,0.007618200499564409,0.004494472872465849
11359717#1138929#3,The sangria's - watered down.,sangria,0,negative,test,0.02433793619275093,0.005565970670431852,0.9700960516929626
11359717#1138929#4,"menu - uneventful, small.",menu,0,negative,test,0.9830989241600037,0.012020105496048927,0.004881083033978939
11313439#692431#0,Anytime and everytime I find myself in the neighborhood I will go to Sushi Rose for fresh sushi and great portions all at a reasonable price.,sushi,2,positive,test,0.0007613058551214635,0.0019117273623123765,0.9973269701004028
11313439#692431#0,Anytime and everytime I find myself in the neighborhood I will go to Sushi Rose for fresh sushi and great portions all at a reasonable price.,portions,2,positive,test,0.0008030870230868459,0.0018412374192848802,0.9973556995391846
11313439#692431#0,Anytime and everytime I find myself in the neighborhood I will go to Sushi Rose for fresh sushi and great portions all at a reasonable price.,price,2,positive,test,0.0007846657535992563,0.0018847915343940258,0.9973305463790894
11351513#832512#0,Great food but the service was dreadful!,food,2,positive,test,0.002465244848281145,0.00206271605566144,0.9954720735549927
11351513#832512#0,Great food but the service was dreadful!,service,0,negative,test,0.9811387658119202,0.008025864139199257,0.010835356079041958
35390148#588852#2,The portions of the food that came out were mediocre.,portions of the food,1,neutral,test,0.005309687461704016,0.9237176775932312,0.07097262144088745
11351513#832512#1,the two waitress's looked like they had been sucking on lemons.,waitress's,0,negative,test,0.8954174518585205,0.0979909673333168,0.006591673009097576
11313431#524365#2,"From the beginning, we were met by friendly staff memebers, and the convienent parking at Chelsea Piers made it easy for us to get to the boat.",staff memebers,2,positive,test,0.000813427846878767,0.0018387949094176292,0.9973477125167847
11313431#524365#2,"From the beginning, we were met by friendly staff memebers, and the convienent parking at Chelsea Piers made it easy for us to get to the boat.",parking,2,positive,test,0.0007881784113124013,0.003162004519253969,0.9960498213768005
35196520#758440#4,We enjoyed ourselves thoroughly and will be going back for the desserts ....,desserts,2,positive,test,0.0006102200713939965,0.0025018625892698765,0.9968878626823425
35196527#481646#2,Desserts are almost incredible: my personal favorite is their Tart of the Day.,Desserts,2,positive,test,0.00114720081910491,0.0016325580654665828,0.9972202777862549
35196527#481646#2,Desserts are almost incredible: my personal favorite is their Tart of the Day.,Tart of the Day,2,positive,test,0.0007453998550772667,0.0019072011345997453,0.997347354888916
35668126#536759#2,"The food was extremely tasty, creatively presented and the wine excellent.",food,2,positive,test,0.0011005119886249304,0.0015876024262979627,0.9973119497299194
35668126#536759#2,"The food was extremely tasty, creatively presented and the wine excellent.",wine,2,positive,test,0.0011137600522488356,0.0015744430711492896,0.9973118305206299
33070286#1133164#6,THE LASAGNA WAS PROBABLY THE BEST I HAVE TASTED.,LASAGNA,2,positive,test,0.0012073558755218983,0.0017501484835520387,0.9970424771308899
32894336#662479#0,Harumi Sushi has the freshest and most delicious array of sushi in NYC.,array of sushi,2,positive,test,0.001083126524463296,0.0015173444990068674,0.9973995685577393
32894336#662479#1,"I highly recommend it for not just its superb cuisine, but also for its friendly owners and staff.",cuisine,2,positive,test,0.0008582953014411032,0.0018671660218387842,0.9972745776176453
32894336#662479#1,"I highly recommend it for not just its superb cuisine, but also for its friendly owners and staff.",owners,2,positive,test,0.0008474524947814643,0.0016892352141439915,0.9974633455276489
32894336#662479#1,"I highly recommend it for not just its superb cuisine, but also for its friendly owners and staff.",staff,2,positive,test,0.0007931659347377717,0.001770318252965808,0.9974365830421448
32892130#435512#0,"If you're craving some serious indian food and desire a cozy ambiance, this is quite and exquisite choice.",indian food,2,positive,test,0.0007570579764433205,0.0022769568022340536,0.9969659447669983
32892130#435512#0,"If you're craving some serious indian food and desire a cozy ambiance, this is quite and exquisite choice.",ambiance,2,positive,test,0.0009545335196889937,0.0020686197094619274,0.9969768524169922
32892130#435512#4,I definitely enjoyed the food as well.,food,2,positive,test,0.0012184956576675177,0.0018038604175671935,0.996977686882019
11432316#715219#2,"It was pleasantly uncrowded, the service was delightful, the garden adorable, the food (from appetizers to entrees) was delectable.",service,2,positive,test,0.0006258708890527487,0.003238447941839695,0.9961357116699219
11432316#715219#2,"It was pleasantly uncrowded, the service was delightful, the garden adorable, the food (from appetizers to entrees) was delectable.",garden,2,positive,test,0.0006155277951620519,0.004326398950070143,0.9950580596923828
11432316#715219#2,"It was pleasantly uncrowded, the service was delightful, the garden adorable, the food (from appetizers to entrees) was delectable.",food,2,positive,test,0.0007570224697701633,0.001973802922293544,0.9972690939903259
11432316#715219#2,"It was pleasantly uncrowded, the service was delightful, the garden adorable, the food (from appetizers to entrees) was delectable.",appetizers,2,positive,test,0.0006252899765968323,0.0026708899531513453,0.9967038035392761
11432316#715219#2,"It was pleasantly uncrowded, the service was delightful, the garden adorable, the food (from appetizers to entrees) was delectable.",entrees,2,positive,test,0.0005726629169657826,0.006203926634043455,0.9932234287261963
11351354#412616#0,"The food is surprisingly good, and the decor is nice.",food,2,positive,test,0.0012635075254365802,0.0016340208239853382,0.9971024394035339
11351354#412616#0,"The food is surprisingly good, and the decor is nice.",decor,2,positive,test,0.0011280911276116967,0.0015855366364121437,0.9972864389419556
35714274#1076679#0,How pretentious and inappropriate for MJ Grill to claim that it provides power lunch and dinners!,lunch,0,negative,test,0.031153785064816475,0.29394039511680603,0.6749057769775391
35714274#1076679#0,How pretentious and inappropriate for MJ Grill to claim that it provides power lunch and dinners!,dinners,0,negative,test,0.021433210000395775,0.37145906686782837,0.6071076393127441
