id,text,term,label_id,label,tvt,pred_0,pred_1,pred_2
2425,"I need at least three rolls to be full, and that's at least $14.00!",rolls,1,neutral,train,0.0038898305501788855,0.9544971585273743,0.04161299392580986
3634,I would highly recommend Nina's to anyone who wants to have a romantic dinner in a heart warming surrounding filled with candles and family pictures.,dinner,2,positive,train,0.0010092600714415312,0.0016736858524382114,0.9973170161247253
1191,Knowledge of the chef and the waitress are below average.,waitress,0,negative,train,0.9878239631652832,0.007573901675641537,0.0046020448207855225
3571,The food was mediocre at best but it was the horrible service that made me vow never to go back.,service,0,negative,train,0.9017996788024902,0.08636252582073212,0.011837765574455261
280,The food is delicious and beautifully prepared along with the friendly and personable service.,food,2,positive,train,0.0010923098307102919,0.0015228335978463292,0.9973848462104797
969,"Light, refreshing summer rolls (not fried) remind me of Vietnamese places in Paris.",summer rolls,2,positive,train,0.0012498580617830157,0.0016445533838123083,0.9971055388450623
1302,And their prices are very high - they actually think that they can get away with charging such prices for such terrible food and service!,prices,0,negative,train,0.9885920882225037,0.007203513756394386,0.004204381722956896
3157,Try the olive cream cheese or the lox spread on a whole wheat everything bagel.,lox spread,2,positive,train,0.0006137885502539575,0.0028296043165028095,0.9965566396713257
318,The atmosphere is great if your looking for a laid back scene and an inexpensive way to spend a weekend afternoon.,atmosphere,2,positive,train,0.0010507397819310427,0.0015670863213017583,0.9973821043968201
2843,From the complimentary chef app of a delicate butternut squash ravioli in a delicious truffle sauce to an amazing buttery and tender langostine entree to a dessert that I can't remember because of the fabulous Cakebread Cabernet we were drinking -- the whole evening was amazing.,Cakebread Cabernet,2,positive,train,0.0015260489890351892,0.024263521656394005,0.9742103815078735
1139,I had never had Edamame pureed before but I thought it was innovative and tasty (could've used a bit more salt).,Edamame pureed,2,positive,train,0.0007679086993448436,0.0020718928426504135,0.9971601963043213
983,"both are very reasonably priced (around $8 for dinner and $5 for lunch), and are delicious and filling.",dinner,2,positive,train,0.0017326753586530685,0.08289619535207748,0.9153710603713989
2384,The fried rice is amazing here.,fried rice,2,positive,train,0.0012308201985433698,0.0017377105541527271,0.9970314502716064
911,"Food was very good as well, considering that we tried the budget selection (though I wish the pork belly that I ordered was roasted a bit longer, so that fat was more of a melt-in-your-mouth experience).",fat,0,negative,train,0.989038348197937,0.006276824977248907,0.004684810992330313
3267,"If you are someone who appreciates the same things but hope to have food to spare or share, Kai may not be the best option.",food,1,neutral,train,0.01929568685591221,0.7435086965560913,0.23719558119773865
858,Service is highly refined: our seating was delayed 35 minutes past our reservation and the maitre d' apologized and regularly kept us apprised of progress.,maitre,2,positive,train,0.9076984524726868,0.06160694733262062,0.03069462813436985
449,Try their plain pizza with fresh garlic or eggplant.,eggplant,2,positive,train,0.0006567997625097632,0.0019872477278113365,0.9973559379577637
2901,"While the $20 entree range is not overly expensive, in New York City, there is definitely better food in that range, and so Sapphire, despite it's lovely atmosphere, will most likely not be a restaurant to which I will return.",entree range,2,positive,train,0.04734373837709427,0.009093249216675758,0.9435629844665527
28,Food was average but tasty.,Food,2,positive,train,0.001112096942961216,0.002706709550693631,0.9961812496185303
2457,"And the staff is also young, energeic and hot!!!!",staff,2,positive,train,0.0010975622572004795,0.0016313183587044477,0.9972711205482483
1575,Our family never expected such incredible entertainment in a restaurant.,entertainment,2,positive,train,0.000988416955806315,0.002057235222309828,0.9969543218612671
2444,The secret is the lunch menu which offers a complimentary appetizer with every entree ordered.,entree,2,positive,train,0.0007629244937561452,0.001899175113067031,0.9973378777503967
768,"If your visiting, you'll enjoy the ambiance and the fact that it's in Time Sq...",ambiance,2,positive,train,0.0008263406925834715,0.0022249333560466766,0.996948778629303
3266,"If you are someone who appreciates simplicity, elegance, and wonderfully presented and tasting seafood and vegetables regardless of portion size, Kai is your place.",seafood,2,positive,train,0.0017304541543126106,0.0025810617953538895,0.9956884980201721
3224,"The menu may be small, but everything on it is delicious.",menu,0,negative,train,0.9840086698532104,0.008794180117547512,0.007197070401161909
2968,"Nice ambiance, nice little bar, good bartender, Francois, and good service.",service,2,positive,train,0.001267144689336419,0.0017030916642397642,0.9970297813415527
2391,Nevertheless the food itself is pretty good.,food,2,positive,train,0.0013122616801410913,0.001716878148727119,0.9969708919525146
1911,"I had a terrific meal, and our server guided us toward a very nice wine in our price range, instead of allowing us to purchase a similarly priced wine that wasn't as good.",meal,2,positive,train,0.0009604303631931543,0.002837896579876542,0.9962016940116882
1095,The quality of food at this restaurant accompanied  by fantastic live jazz makes this place a perfect 10!,live jazz,2,positive,train,0.0010281384456902742,0.0015159526374191046,0.997455894947052
2079,"The staff was accomodating, the food was absolutely delicious and the place is lovely.",food,2,positive,train,0.0010522421216592193,0.001583515084348619,0.9973642230033875
2791,"The porcini mushroom pasta special was tasteless, so was the seafood tagliatelle.",porcini mushroom pasta special,0,negative,train,0.9887528419494629,0.006908836774528027,0.004338283557444811
845,The dining room is quietly elegant with no music to shout over -- how refreshing!,dining room,2,positive,train,0.0011444184929132462,0.0015993803972378373,0.9972562193870544
2688,The food can get pricey but the prixe fixe tasting menu is the greatest food for a good price and they cater the food to any food allergies or food you don't like.,food,1,neutral,train,0.9092044234275818,0.03792508691549301,0.052870459854602814
1190,You have to increase the service a lot.,service,0,negative,train,0.970704972743988,0.024779120460152626,0.004516005516052246
550,"We have been to this place many times, and always have great food, wine, and service.",food,2,positive,train,0.001079266774468124,0.0016326488694176078,0.9972881078720093
2882,The sweet lassi was excellent as was the lamb chettinad and the garlic naan but the rasamalai was forgettable.,rasamalai,0,negative,train,0.9869316220283508,0.0062633384950459,0.006805045995861292
2963,Their wines by the glass are a great accompaniment and you can eat like a king with wine for under $30.,wines by the glass,2,positive,train,0.0007048374973237514,0.004363131243735552,0.9949319958686829
1440,The hot and sour soup was unbearably hot and tasted of only pepper and nothing else.,soup,0,negative,train,0.988800048828125,0.006944270338863134,0.004255577456206083
3220,Here's to the fake fish tanks too...,fish tanks,0,negative,train,0.9846926927566528,0.010561021976172924,0.00474634300917387
2582,"NO more reservations, expensive tips and annoying stuff.",reservations,2,positive,train,0.0022635699715465307,0.003571417648345232,0.9941650032997131
3524,We always get a sampling of appetizers and share.,appetizers,1,neutral,train,0.0037899890448898077,0.940261960029602,0.055947985500097275
284,Been going here since it opened have seen the quality value decrease considerably.,quality value,0,negative,train,0.9871527552604675,0.00875160377472639,0.004095715936273336
1000,"The food is good, especially their more basic dishes, and the drinks are delicious.",food,2,positive,train,0.001047939877025783,0.001643147086724639,0.9973089694976807
2085,The one vegetarian entree (Abby's treasure) was actually quite a surprise - it was delicious and had wintermelon covering an assortment of fresh mushrooms and vegetables.,assortment of fresh mushrooms and vegetables,2,positive,train,0.0008562860894016922,0.001958567416295409,0.9971851706504822
29,"Dessert - can't be missed, so save room!!!",Dessert,2,positive,train,0.0012102470500394702,0.0020521103870123625,0.9967376589775085
1846,"The highlight of the night was the mayonaisse for my side of fries I received from one of the food runners, which is not good considering the bill was nearly $100.",mayonaisse,0,negative,train,0.9027405977249146,0.08842712640762329,0.008832325227558613
2688,The food can get pricey but the prixe fixe tasting menu is the greatest food for a good price and they cater the food to any food allergies or food you don't like.,food,0,negative,train,0.9092044234275818,0.03792508691549301,0.052870459854602814
3381,"In fact, two people could really share one plate.",plate,2,positive,train,0.0010967488633468747,0.0033310491126030684,0.9955722093582153
773,All we received was an apology as we left to see our show without dinner.,dinner,1,neutral,train,0.0054517169483006,0.9135604500770569,0.0809878334403038
898,But the thing that my wife and I hated was it was so loud and it felt like 'bar' or 'pub'.,bar,0,negative,train,0.9892536997795105,0.006917853374034166,0.003828377928584814
979,The service is descent even when this small place is packed.,service,2,positive,train,0.04214167594909668,0.05946720018982887,0.8983911871910095
414,"Average to good Thai food, but terrible delivery.",Thai food,2,positive,train,0.0024719303473830223,0.0019933830481022596,0.9955346584320068
2458,"It's the perfect restaurant for NY life style, it got cool design, awsome drinks and food and lot's of good looking people eating and hanging at the pink bar...",drinks,2,positive,train,0.0010045538656413555,0.001588657614775002,0.9974067807197571
704,"Try the Pad Thai, it's fabulous and their prices are so cheap!",prices,2,positive,train,0.001022578333504498,0.0015400531701743603,0.9974373579025269
37,The only friendly staff member was the guy at the bar.,staff member,2,positive,train,0.0009315421339124441,0.006543871946632862,0.9925245642662048
3202,"We are very particular about sushi and were both please with every choice which included: ceviche mix (special), crab dumplings, assorted sashimi, sushi and rolls, two types of sake, and the banana tempura.",assorted sashimi,2,positive,train,0.0008082451531663537,0.0016549932770431042,0.9975367784500122
2774,Service is not what one would expect from a joint in this price category.,Service,0,negative,train,0.9842945337295532,0.012071599252521992,0.003633802989497781
2667,"The Halibut was too salty, dessert was so so (don't waste any of your calories) and service was poor.",Halibut,0,negative,train,0.9863335490226746,0.010215699672698975,0.0034507561940699816
2646,"Only wine and beer are served, but the house varities are actually quite good.",served,0,negative,train,0.6312088370323181,0.316249817609787,0.05254129692912102
813,"All the appetizers and salads were fabulous, the steak was mouth watering and the pasta was delicious!!!",appetizers,2,positive,train,0.0008762830402702093,0.0016047359677031636,0.9975190162658691
2767,"Whether it's the parmesean porcini souffle or the lamb glazed with balsamic vinegar, you will surely be transported to Northern Italy with one bite.",parmesean porcini souffle,2,positive,train,0.0009085742640309036,0.00158079678658396,0.9975106716156006
41,Horrible food and Horrible service.,food,0,negative,train,0.9847546815872192,0.009765379130840302,0.005479947663843632
2086,The meat dishes were only so-so.,meat dishes,1,neutral,train,0.003055144567042589,0.9369717836380005,0.05997316539287567
2030,Our friendly server made great food suggestions and also sent both the sommelier and the fromager to the table to help suggest different pairings for wine and cheese.,server,2,positive,train,0.0010004155337810516,0.008605098351836205,0.9903945326805115
1182,"The food is very good for it's price, better than most fried dumplings I've had.",fried dumplings,0,negative,train,0.06638939678668976,0.024470293894410133,0.9091403484344482
3225,I particularly love their yellowfun tuna and their mussel selection.,yellowfun tuna,2,positive,train,0.0009102618787437677,0.0016818804433569312,0.997407853603363
2405,Great food at reasonable prices.,prices,2,positive,train,0.001048715435899794,0.0017766838427633047,0.9971746206283569
3071,Cozy romantic atomosphere with only around 15 tables at most.,tables,2,positive,train,0.0006606732495129108,0.0029300132300704718,0.9964093565940857
1325,"I took my girlfriend there for her birthday last night and we had a relaxing, really good meal.",meal,2,positive,train,0.0008870273595675826,0.0019163317047059536,0.9971966743469238
1970,The steak was excellent and one of the best I have had (I tasted the butter intitally but in no way did it overwhelm the flavor of the meat).,steak,2,positive,train,0.028919672593474388,0.013838781975209713,0.9572415351867676
2160,They have a huge selection of different cream cheeses and all of their salads are great.,cream cheeses,2,positive,train,0.0007880920311436057,0.0016672329511493444,0.9975447058677673
3332,"However, in the summer of 2003, it seems the management has changed and the great big door has been replaced for a glass front ridding itself of the dark romantic getup.",glass front,0,negative,train,0.9642208814620972,0.028899844735860825,0.0068792421370744705
874,"I went at 6:00 PM specifically for the pre-theater menu ($19.95 for roasted tomato soup with chevre, steak frites, creme brulee) and it was marvelous.",pre-theater menu,2,positive,train,0.0006774314679205418,0.00264356448315084,0.9966790676116943
982,"the real kicker of the menu, however, is the beef cubes or the chicken with chili and lemon grass.",chicken with chili and lemon grass,2,positive,train,0.0010282767470926046,0.0017297606682404876,0.9972419738769531
1491,The sauce is delicious and the crust is perfect.,crust,2,positive,train,0.0012202206999063492,0.0015749101294204593,0.9972048401832581
1735,I can't believe people complain about no cheese sticks?,cheese sticks,1,neutral,train,0.004162919241935015,0.9583288431167603,0.037508174777030945
601,We went to eat at the Jekyll and Hyde restaurant on Friday night and really enjoyed the fun atmosphere and good food.,food,2,positive,train,0.0007575151394121349,0.002329279901459813,0.9969131946563721
2455,"The staff is very kind and well trained, they're fast, they are always prompt to jump behind the bar and fix drinks, they know details of every item in the menu and make excelent recomendations.",drinks,1,neutral,train,0.005320999305695295,0.9592603445053101,0.03541865199804306
1644,The all you can eat deal is truly amazing here.,all you can eat deal,2,positive,train,0.001153718214482069,0.0016434126300737262,0.9972028732299805
1683,"The vibe is very relaxed and cozy, service was great and the food was excellent!",vibe,2,positive,train,0.0012328954180702567,0.0016091607976704836,0.9971579313278198
443,"Pizza - the only pizza in NYC that should not have additional toppings - the crust tastes like the best, freshly baked bread!",bread,2,positive,train,0.0015875257086008787,0.032686833292245865,0.9657256603240967
1023,They've the best desserts and mixed drinks as well as snack foods.,snack foods,2,positive,train,0.001139485277235508,0.0016688171308487654,0.9971917271614075
1600,"The combination of fresh tomato sauce, fresh mozz cheese, basil and the dough they make with imported flour, makes this is one of the better pizza's in NY.",flour,2,positive,train,0.0009627998806536198,0.0015427726320922375,0.9974944591522217
224,"The food was terrific and the service classy, attentive, without being overbearing.",food,2,positive,train,0.001259818789549172,0.0016655384097248316,0.9970746040344238
272,Pair you food with the excellent beers on tap or their well priced wine list.,priced,2,positive,train,0.0006009091157466173,0.0022906193044036627,0.997108519077301
846,"The service was impeccable and unobtrusive -- the staff knows what they are there to do -- to know their menu, present your meal, and attend to your needs.",menu,1,neutral,train,0.004371343180537224,0.953599750995636,0.04202892258763313
2783,This is a consistently great place to dine for lunch or dinner.,lunch,1,neutral,train,0.006623742636293173,0.9054269790649414,0.0879492536187172
2512,"good music, great food, speedy service affordable prices.",food,2,positive,train,0.0011932899942621589,0.0016685905866324902,0.9971381425857544
2537,"It is about FOOD and Ambiance, and imagine how dreadful it will be it we only had to listen to an idle engine.",Ambiance,0,negative,train,0.9889066219329834,0.0066670808009803295,0.004426318220794201
1471,"A large is $20, and toppings are about $3 each.",toppings,1,neutral,train,0.0038510505110025406,0.938969075679779,0.05717983841896057
2946,"Solid wine list, knowledgeable staff, friendly owners and an adventurous, ever-changing menu keep us coming back.",menu,2,positive,train,0.0009432956576347351,0.0016621577087789774,0.9973945617675781
711,(and I have eaten my share) Which impresses me for having such a large amount of people to serve.,serve,2,positive,train,0.0006418975535780191,0.006712382193654776,0.9926457405090332
2944,We've been to Grocery three times and not once has an item on the menu disappointed.,menu,2,positive,train,0.0010846146615222096,0.00885163713246584,0.9900637269020081
461,Friendly staff that actually lets you enjoy your meal and the company you're with.,meal,2,positive,train,0.0009861548896878958,0.001704359077848494,0.9973094463348389
1985,"Even with a relatively inexpensive botle of wine, if you can call $70.00 inexpensive, the cost is through the roof for better than average fare.",cost,0,negative,train,0.9899663925170898,0.005997761618345976,0.0040358067490160465
968,"Top spot in town for Vietnamese classics, better than places that cost a lot more.",Vietnamese classics,2,positive,train,0.0015506737399846315,0.00174379360396415,0.9967055916786194
2067,Decor is nice though service can be spotty.,service,0,negative,train,0.985095202922821,0.007822012528777122,0.007082762196660042
3275,"Again, the waitress was awesome.",waitress,2,positive,train,0.0013577173231169581,0.0018606858793646097,0.996781587600708
82,"Very romantic fires - I've literally spent hours at Lanterna, drinking wine from their extensive wine and enjoying the ambience.",ambience,2,positive,train,0.0006646981346420944,0.002391141839325428,0.9969441294670105
1733,Decor is charming.,Decor,2,positive,train,0.0014762323116883636,0.0020269150845706463,0.996496856212616
3,"The staff isn't the friendliest or most competent, and I am stickler for service, but everything else about this place makes up for it.",service,0,negative,train,0.9894017577171326,0.006646501831710339,0.003951734397560358
2573,Although we were looking for regular lettuce and some walnuts the salads we got were great.,walnuts,1,neutral,train,0.0037802821025252342,0.9568415880203247,0.03937816619873047
2856,"Despite the fact that the space is large, they've overcrowded the floor with tables.",space,2,positive,train,0.4841860830783844,0.2505170702934265,0.2652968466281891
2698,We were also seated promptly at the time of our reservation and the service was very quick and professional.,service,2,positive,train,0.0008330501150339842,0.0019001377513632178,0.9972668886184692
3667,"But when you are seated the waitresses are great, they explain everything on the menu, and the price of the food is really cheap for the service you get.",food,1,neutral,train,0.03209437057375908,0.7380329370498657,0.2298727035522461
2891,"Over the years, it has always provided a pleasurable dining experience with quality food and wine.",wine,2,positive,train,0.0010688039474189281,0.0015521106543019414,0.9973790645599365
267,The bar is very well stocked with interesting beers and well priced wines.,priced,2,positive,train,0.0008241801988333464,0.0017212186940014362,0.9974545836448669
1125,"The music does get a little loud at times, but it just made me want to lean closer to my beautiful wife, and as I did, I got a whiff of corriander.",corriander,1,neutral,train,0.006693282630294561,0.9706953167915344,0.02261141687631607
3425,We had the scallops as an appetizer and they were delicious and the sauce was wonderful.,sauce,2,positive,train,0.0009737558430060744,0.0015982118202373385,0.9974279999732971
1607,"The service is a bit slow, but harkens back to my years growing up in Napoli, Italy where things are not rushed and when you sit down for dinner the table is yours all night.",service,0,negative,train,0.9633103609085083,0.027164382860064507,0.009525286965072155
1041,The people in the restaurant were pretty obnoxious and loud.,people,0,negative,train,0.98711097240448,0.008697663433849812,0.004191362299025059
785,Here you get the zen feel without feeling rigid.,zen feel,2,positive,train,0.0008004289702512324,0.002549639204517007,0.9966499209403992
2827,"The food was below average, the service was pathetic, there was no ambience at all.",food,0,negative,train,0.9882978796958923,0.007245817221701145,0.004456349182873964
1424,"my picks are:  - Scallion Pancake (fried with vegetable juice, very special and tasty)  - Guizhou Chicken  - Shredded Squid Family Style (one of my personal favorites)  - Sichuan Spicy Soft Shell Crab  - Shuizhu Fish (this one is for hardcore Sichuan food fans, I wouldn't recommend to my American friends as it's very spicy.",Scallion Pancake,2,positive,train,0.0018142565386369824,0.018496060743927956,0.9796897172927856
556,"I am amazed by the poor reviews- I find this place to be standout Italian in an area flooded with Italian- great prices, great atmosphere, good service and a wonderful wine list.",atmosphere,2,positive,train,0.0009453533566556871,0.001825758721679449,0.9972289204597473
1952,The service was excellent and the food was delicious.,service,2,positive,train,0.0011946670711040497,0.0016182323452085257,0.997187077999115
2681,The white bean brushetta to start was incredible and the pasta was phenomenal.,pasta,2,positive,train,0.0008784972014836967,0.0018344601849094033,0.9972870349884033
1940,"Super friendly and knowledgable staff, fabulous bistro fare and a wonderful jazz brunch with great live jazz (the chilaquiles were awesome!",bistro fare,2,positive,train,0.0009051241213455796,0.001566341263242066,0.9975284934043884
2001,"($200 for 2 glasses of champagne, not too expensive bottle of wine and 2 after dinner drinks).",after dinner drinks,0,negative,train,0.9817785024642944,0.01433746051043272,0.0038839809130877256
2905,i don't usually order wine with indian so i can't comment on their wine list or their wines.,wine,1,neutral,train,0.003985024057328701,0.9670943021774292,0.028920693323016167
2855,While the food was good (certainly no Il Mulino) the service was horrendous.,service,0,negative,train,0.9863116145133972,0.00811429601162672,0.005574079696089029
3245,"Even upon delivery, their juicy pork buns are quite good . .",pork buns,2,positive,train,0.0013343412429094315,0.0016567556886002421,0.9970089793205261
2654,I ordered the crab cocktail and it was soaked in a lime juice concoction where all you could taste was the lime.,lime,1,neutral,train,0.01569843292236328,0.9428977966308594,0.041403789073228836
3600,It looked like shredded cheese partly done - still in strips.,shredded cheese,0,negative,train,0.9842357635498047,0.01124622207134962,0.004518063738942146
3211,"After 2 tries by the waiter to take it away (we hadn't even looked at it yet, we had full beers yet to drink), the manager approached and told us they needed the table for people with reservations.",reservations,2,positive,train,0.019806602969765663,0.4136087894439697,0.566584587097168
2117,"those rolls were big, but not good and sashimi wasn't fresh.",sashimi,0,negative,train,0.9872269034385681,0.008902526460587978,0.0038706103805452585
2066,"Don't dine at Tamarind for the vegetarian dishes, they are simply not up to par with the non-veg selections.",vegetarian dishes,0,negative,train,0.9774372577667236,0.011688589118421078,0.010874196887016296
800,My fiance took me to Scopa last week for my birthday and I couldn't believe the food.,food,2,positive,train,0.0006198598421178758,0.003068601945415139,0.9963114857673645
2847,"Complimentary stuff kept coming, and when the waiter saw me opening a gift, I received my dessert on a plate that had Happy Birthday written on it, with a candlevery nice touch, and attentive staff.",waiter,2,positive,train,0.056917693465948105,0.2951318621635437,0.6479504704475403
1866,"I had the tuna tartare with sake, mushroom ravioli with pinot noir, and the chocolate sampler with a dessert wine for $49.",dessert wine,2,positive,train,0.0010100104846060276,0.0016612509498372674,0.9973287582397461
2406,"For appetizers, I recommend the shrimp fritters and dumplings.",shrimp fritters,2,positive,train,0.0009343958809040487,0.033853765577077866,0.9652118682861328
764,I ordered a Chicken Teriyaki dish and found that the chicken was extremely dry.,chicken,0,negative,train,0.9877699017524719,0.008501743897795677,0.003728321520611644
